{
  "schemaVersion": "1.1.0",
  "canonicalDirectories": [
    "cases",
    "schemas"
  ],
  "pages": [
    {
      "source": "manuscript/02-law-ethics-authorization.md",
      "destination": "chapters/chapter-02/index.md",
      "section": "chapters",
      "order": 45,
      "title": "第2章 法、倫理、許可、責任ある開示"
    },
    {
      "source": "manuscript/03-capability-evidence.md",
      "destination": "chapters/chapter-03/index.md",
      "section": "chapters",
      "order": 46,
      "title": "第3章 能力を分解し、証拠で学習する"
    },
    {
      "source": "manuscript/04-assets-boundaries-threat-model.md",
      "destination": "chapters/chapter-04/index.md",
      "section": "chapters",
      "order": 47,
      "title": "第4章 資産、信頼境界、攻撃面、脅威モデル"
    },
    {
      "source": "manuscript/11-web-api-hypothesis.md",
      "destination": "chapters/chapter-11/index.md",
      "section": "chapters",
      "order": 54,
      "title": "第11章 Web・APIを仮説駆動で評価する"
    },
    {
      "source": "templates/integrated-security-case-map.md",
      "destination": "templates/integrated-security-case-map/index.md",
      "section": "additional",
      "order": 220,
      "title": "Integrated Security Case Map"
    },
    {
      "source": "cases/ch01-integrated-security-case-example.md",
      "destination": "cases/chapter-01-integrated-security-case/index.md",
      "section": "additional",
      "order": 230,
      "title": "第1章 合成記入例：請求書連携OAuthアプリの権限見直し"
    },
    {
      "source": "templates/authorization-checklist.md",
      "destination": "templates/authorization-checklist/index.md",
      "section": "additional",
      "order": 232,
      "title": "Authorization Checklist"
    },
    {
      "source": "cases/ch02-authorization-decision-example.md",
      "destination": "cases/chapter-02-authorization-decision/index.md",
      "section": "additional",
      "order": 233,
      "title": "第2章 合成記入例：OAuth連携評価前のAuthorization判断"
    },
    {
      "source": "templates/capability-evidence-matrix.md",
      "destination": "templates/capability-evidence-matrix/index.md",
      "section": "additional",
      "order": 234,
      "title": "Capability Evidence Matrix"
    },
    {
      "source": "cases/ch03-capability-evidence-example.md",
      "destination": "cases/chapter-03-capability-evidence/index.md",
      "section": "additional",
      "order": 236,
      "title": "第3章 合成記入例：Capability Evidence Matrix"
    },
    {
      "source": "references/ch03-source-review-2026-08-05.md",
      "destination": "references/chapter-03-source-review/index.md",
      "section": "additional",
      "order": 237,
      "title": "第3章 Source Review Note：NICE Framework"
    },
    {
      "source": "cases/index.md",
      "destination": "cases/index.md",
      "section": "additional",
      "order": 238,
      "title": "合成Case索引"
    },
    {
      "source": "templates/web-api-assessment-hypothesis-pack.md",
      "destination": "templates/web-api-assessment-hypothesis-pack/index.md",
      "section": "additional",
      "order": 240,
      "title": "Web/API Assessment Hypothesis Pack"
    },
    {
      "source": "templates/threat-model.md",
      "destination": "templates/threat-model/index.md",
      "section": "additional",
      "order": 150,
      "title": "Threat Model"
    },
    {
      "source": "cases/ch04-threat-model-example.md",
      "destination": "cases/chapter-04-threat-model/index.md",
      "section": "additional",
      "order": 241,
      "title": "第4章 合成記入例：資産・信頼境界・脅威モデル"
    },
    {
      "source": "references/ch04-source-review-2026-08-08.md",
      "destination": "references/chapter-04-source-review/index.md",
      "section": "additional",
      "order": 242,
      "title": "第4章 Source Review Note：Threat Model"
    },
    {
      "source": "cases/ch11-web-api-assessment-example.md",
      "destination": "cases/chapter-11-web-api-assessment/index.md",
      "section": "additional",
      "order": 250,
      "title": "第11章 合成記入例：マルチテナント受注Export APIとWebhook登録の評価"
    },
    {
      "source": "manuscript/17-detection-engineering.md",
      "destination": "chapters/chapter-17/index.md",
      "section": "chapters",
      "order": 200,
      "title": "第17章 Detection Engineering"
    },
    {
      "source": "cases/ch17-detection-validation-example.md",
      "destination": "cases/chapter-17-detection-validation/index.md",
      "section": "additional",
      "order": 260,
      "title": "第17章 合成記入例：未承認管理者同意変更のDetection Validation"
    },
    {
      "source": "cases/fixtures/ch17-detection-engineering-fixture.md",
      "destination": "cases/fixtures/ch17-detection-engineering-fixture/index.md",
      "section": "additional",
      "order": 270,
      "title": "第17章 オフラインfixture：未承認管理者同意変更の検知検証"
    },
    {
      "source": "templates/analytic-judgment-record.md",
      "destination": "templates/analytic-judgment-record/index.md",
      "section": "additional",
      "order": 280,
      "title": "Analytic Judgment Record"
    },
    {
      "source": "cases/fixtures/index.md",
      "destination": "cases/fixtures/index.md",
      "section": "additional",
      "order": 290,
      "title": "Fixture Catalog"
    },
    {
      "source": "cases/ch25-structured-analysis-attribution-example.md",
      "destination": "cases/chapter-25-structured-analysis-attribution/index.md",
      "section": "additional",
      "order": 300,
      "title": "第25章 合成記入例：共同報告に埋もれた技術クラスタの判断"
    },
    {
      "source": "manuscript/25-structured-analysis-attribution.md",
      "destination": "chapters/chapter-25/index.md",
      "section": "chapters",
      "order": 210,
      "title": "第25章 構造化分析、不確実性、アトリビューション"
    },
    {
      "source": "manuscript/05-attack-behavior.md",
      "destination": "chapters/chapter-05/index.md",
      "section": "chapters",
      "order": 48,
      "title": "第5章 攻撃者の行動をATT&CKで記述する"
    },
    {
      "source": "templates/attack-behavior-map.md",
      "destination": "templates/attack-behavior-map/index.md",
      "section": "additional",
      "order": 243,
      "title": "ATT&CK Behavior Map"
    },
    {
      "source": "cases/ch05-attack-behavior-example.md",
      "destination": "cases/chapter-05-attack-behavior/index.md",
      "section": "additional",
      "order": 244,
      "title": "第5章 合成記入例：ATT&CK Behavior Map"
    },
    {
      "source": "references/ch05-source-review-2026-09-06.md",
      "destination": "references/chapter-05-source-review/index.md",
      "section": "additional",
      "order": 245,
      "title": "第5章 Source Review Note：ATT&CK"
    },
    {
      "source": "manuscript/06-observable-systems.md",
      "destination": "chapters/chapter-06/index.md",
      "section": "chapters",
      "order": 49,
      "title": "第6章 通信・Identity・Cloudを観測可能なシステムとして読む"
    },
    {
      "source": "templates/signal-flow-diagram.md",
      "destination": "templates/signal-flow-diagram/index.md",
      "section": "additional",
      "order": 246,
      "title": "Signal Flow Diagram"
    },
    {
      "source": "cases/ch06-signal-flow-example.md",
      "destination": "cases/chapter-06-signal-flow/index.md",
      "section": "additional",
      "order": 247,
      "title": "第6章 完全合成記入例：Signal Flow Diagram"
    },
    {
      "source": "references/ch06-source-review-2026-09-12.md",
      "destination": "references/chapter-06-source-review/index.md",
      "section": "additional",
      "order": 248,
      "title": "第6章 Source Review Note：Signal Flow"
    },
    {
      "source": "manuscript/07-vulnerability-prioritization.md",
      "destination": "chapters/chapter-07/index.md",
      "section": "chapters",
      "order": 50,
      "title": "第7章 脆弱性、露出、悪用可能性、事業影響を分ける"
    },
    {
      "source": "templates/vulnerability-prioritization-record.md",
      "destination": "templates/vulnerability-prioritization-record/index.md",
      "section": "additional",
      "order": 251,
      "title": "Vulnerability Prioritization Record"
    },
    {
      "source": "cases/ch07-vulnerability-prioritization-example.md",
      "destination": "cases/chapter-07-vulnerability-prioritization/index.md",
      "section": "additional",
      "order": 252,
      "title": "第7章 完全合成記入例：Vulnerability Prioritization Record"
    },
    {
      "source": "references/ch07-source-review-2026-09-12.md",
      "destination": "references/chapter-07-source-review/index.md",
      "section": "additional",
      "order": 253,
      "title": "第7章 Source Review Note：Vulnerability Prioritization"
    },
    {
      "source": "manuscript/08-safe-lab-evidence.md",
      "destination": "chapters/chapter-08/index.md",
      "section": "chapters",
      "order": 51,
      "title": "第8章 安全で再現可能なラボと証拠管理"
    },
    {
      "source": "templates/lab-safety-evidence-plan.md",
      "destination": "templates/lab-safety-evidence-plan/index.md",
      "section": "additional",
      "order": 254,
      "title": "Lab Safety and Evidence Plan"
    },
    {
      "source": "cases/ch08-lab-evidence-example.md",
      "destination": "cases/chapter-08-lab-evidence/index.md",
      "section": "additional",
      "order": 255,
      "title": "第8章 完全合成記入例：Lab Safety and Evidence Plan"
    },
    {
      "source": "references/ch08-source-review-2026-09-13.md",
      "destination": "references/chapter-08-source-review/index.md",
      "section": "additional",
      "order": 256,
      "title": "第8章 Source Review Note：Lab SafetyとEvidence"
    },
    {
      "source": "manuscript/09-engagement-roe.md",
      "destination": "chapters/chapter-09/index.md",
      "section": "chapters",
      "order": 52,
      "title": "第9章 Engagement DesignとRules of Engagement"
    },
    {
      "source": "cases/ch09-engagement-roe-example.md",
      "destination": "cases/chapter-09-engagement-roe/index.md",
      "section": "additional",
      "order": 257,
      "title": "第9章 完全合成記入例：Rules of Engagement"
    },
    {
      "source": "references/ch09-source-review-2026-09-13.md",